<?xml version="1.0" encoding="UTF-8"?>
<!DOCTYPE agency_report SYSTEM "Part1.dtd">
<agency_report>
    <name></name>
    <date day="" month="" year="2019"></date>
    <city></city>
    <address></address>
    <body>
        <employee staff_id="E1">
            <name></name>
            <age></age>
            <salary currency="Euro"></salary>
        </employee>
        <employee staff_id="E2">
            <name></name>
            <age></age>
            <salary currency="Euro"></salary>
        </employee>
        <employee staff_id="E3">
            <name></name>
            <age></age>
            <salary currency="Euro"></salary>
        </employee>
        <employee staff_id="E4">
            <name></name>
            <age></age>
            <salary></salary>
        </employee>
        <employee staff_id="E5">
            <name></name>
            <age></age>
            <salary></salary>
        </employee>
        <employee staff_id="E6">
            <name></name>
            <age></age>
            <salary></salary>
        </employee>
        <tour tour_name="Kerry" type="domestic" mode_transport="bus">
            <destination>
                <country></country>
                <city></city>
            </destination>
            <leader></leader>
            <leader></leader>
            <price></price>
            <date day="" month="" year="2019"></date>
        </tour>
        <tour tour_name="Cork" type="domestic" mode_transport="train">
            <destination>
                <country></country>
                <city></city>
            </destination>
            <leader></leader>
            <price></price>
            <date day="" month="" year="2019"></date>
        </tour>
        <tour tour_name="London" type="international" mode_transport="air">
            <destination>
                <country></country>
                <city></city>
            </destination>
            <leader></leader>
            <price></price>
            <date day="" month="" year="2019"></date>
        </tour>
        <tour tour_name="Glendalough" type="domestic" mode_transport="bus">
            <destination>
                <country></country>
                <city></city>
            </destination>
            <leader></leader>
            <leader></leader>
            <price></price>
            <date day="" month="" year="2019"></date>
        </tour>
        <finance_report>
            <fullYear>                
                <trip trip_name="Kerry">
                    <customer>
                        <name></name>
                        <age></age>
                    </customer>
                    <customer>
                        <name></name>
                        <age></age>
                    </customer>
                    <customer>
                        <name></name>
                        <age></age>
                    </customer>
                    <customer>
                        <name></name>
                        <age></age>
                    </customer>
                </trip>
                <trip trip_name="Cork">
                    <customer>
                        <name></name>
                        <age></age>
                    </customer>
                    <customer>
                        <name></name>
                        <age></age>
                    </customer>
                    <customer>
                        <name></name>
                        <age></age>
                    </customer>
                    <customer>
                        <name></name>
                        <age></age>
                    </customer>
                </trip>
                <income></income>
               </fullYear>
            <fullSeason>
                <ticket_only> </ticket_only>
                <trip trip_name="London">
                    <customer gender="Female">
                       <name></name>
                        <age></age>
                     </customer>
                     <customer gender="Female">
                        <name></name>
                        <age></age>
                    </customer>
                    <customer gender="Female">
                        <name></name>
                        <age></age>
                    </customer>
                  </trip>
                <income></income>
             
            </fullSeason>
            <fullSeason>
                <trip trip_name="Glendalough">
                    <customer>
                        <name></name>
                        <age></age>
                    </customer>
                    <customer>
                        <name></name>
                        <age></age>
                    </customer>
                    <customer>
                        <name></name>
                        <age></age>
                    </customer>
                    <customer>
                        <name></name>
                        <age></age>
                    </customer>
                </trip>
                <income></income>
            </fullSeason>
            <fullSeason  seasonName="Winter">
                <ticket_only></ticket_only>
                <ticket_only></ticket_only>
                <trip trip_name="Kerry">
                    <customer>
                        <name></name>
                        <age></age>
                    </customer>
                    <customer>
                        <name></name>
                        <age></age>
                    </customer>
                    <customer>
                        <name></name>
                        <age></age>
                    </customer>
                    <customer>
                        <name></name>
                        <age></age>
                    </customer>
                    <customer>
                        <name></name>
                        <age></age>
                    </customer>
                </trip>
                <trip trip_name="Cork">
                    <customer>
                        <name></name>
                        <age></age>
                    </customer>
                    <customer>
                        <name></name>
                        <age></age>
                    </customer>
                    <customer>
                        <name></name>
                        <age></age>
                    </customer>
                    <customer>
                        <name></name>
                        <age></age>
                    </customer>
                    <customer>
                        <name></name>
                        <age></age>
                    </customer>
                </trip>
                <income></income>
            </fullSeason>
            
        </finance_report>
    </body>
    <website> &ws; </website>
</agency_report>